{
  "schemaVersion": "project-os.project-capabilities.v0.1",
  "updatedAt": "2026-07-11",
  "workspaceCapabilities": [
    {
      "id": "project-overview",
      "status": "enabled",
      "source": "core"
    },
    {
      "id": "tasks",
      "status": "enabled",
      "source": "core"
    },
    {
      "id": "files",
      "status": "enabled",
      "source": "core"
    },
    {
      "id": "goals",
      "status": "enabled",
      "source": "migration"
    },
    {
      "id": "rules",
      "status": "enabled",
      "source": "user",
      "signals": [
        "AGENTS.md",
        "docs/ROUTING.md"
      ]
    },
    {
      "id": "design-implementation",
      "status": "enabled",
      "source": "user",
      "signals": [
        "docs/ARCHITECTURE.md",
        "desktop/src"
      ]
    },
    {
      "id": "validation-delivery",
      "status": "enabled",
      "source": "user",
      "signals": [
        "tests",
        "docs/TESTING.md"
      ]
    },
    {
      "id": "knowledge-memory",
      "status": "enabled",
      "source": "user",
      "signals": [
        "HANDOFF.md",
        "docs/DECISIONS.md"
      ]
    },
    {
      "id": "agent-configuration",
      "status": "enabled",
      "source": "migration"
    }
  ],
  "domainCapabilities": [
    {
      "id": "frontend",
      "status": "detected",
      "source": "scan",
      "signals": [
        "desktop/package.json",
        "desktop/src"
      ]
    },
    {
      "id": "backend",
      "status": "available",
      "source": "scan",
      "signals": []
    },
    {
      "id": "database",
      "status": "available",
      "source": "scan",
      "signals": []
    },
    {
      "id": "desktop",
      "status": "detected",
      "source": "scan",
      "signals": [
        "desktop/src-tauri"
      ]
    },
    {
      "id": "cli",
      "status": "detected",
      "source": "scan",
      "signals": [
        "cli"
      ]
    },
    {
      "id": "ai",
      "status": "detected",
      "source": "scan",
      "signals": [
        ".project-os/model-catalog.json"
      ]
    },
    {
      "id": "testing",
      "status": "detected",
      "source": "scan",
      "signals": [
        "tests"
      ]
    },
    {
      "id": "deployment",
      "status": "detected",
      "source": "scan",
      "signals": [
        ".github/workflows"
      ]
    }
  ],
  "capabilities": [
    {
      "id": "project-overview",
      "status": "enabled",
      "source": "core"
    },
    {
      "id": "tasks",
      "status": "enabled",
      "source": "core"
    },
    {
      "id": "files",
      "status": "enabled",
      "source": "core"
    },
    {
      "id": "goals",
      "status": "enabled",
      "source": "migration"
    },
    {
      "id": "rules",
      "status": "enabled",
      "source": "user",
      "signals": [
        "AGENTS.md",
        "docs/ROUTING.md"
      ]
    },
    {
      "id": "design-implementation",
      "status": "enabled",
      "source": "user",
      "signals": [
        "docs/ARCHITECTURE.md",
        "desktop/src"
      ]
    },
    {
      "id": "validation-delivery",
      "status": "enabled",
      "source": "user",
      "signals": [
        "tests",
        "docs/TESTING.md"
      ]
    },
    {
      "id": "knowledge-memory",
      "status": "enabled",
      "source": "user",
      "signals": [
        "HANDOFF.md",
        "docs/DECISIONS.md"
      ]
    },
    {
      "id": "agent-configuration",
      "status": "enabled",
      "source": "migration"
    }
  ]
}
